case_id,scenario_id,city,recommended_district_id,alternative_district_id,estimated_commute_minutes,estimated_rent_range_usd,decision_rationale,status
R-0001,S-RENT-001,Алматы,DST-ALM-02,DST-ALM-05,38,"750-950","Сбалансированный выбор для офисной релокации одного человека: лучше по времени в пути, чем более дешёвые окраины, и выгоднее премиального центра",approved
R-0002,S-RENT-002,Ереван,DST-EVN-03,DST-EVN-05,30,"950-1300","Хороший баланс предложения с размещением с животными, бытовых сервисов и не слишком высокой цены за центральность",approved
R-0003,S-RENT-003,Ташкент,DST-TAS-04,DST-TAS-06,42,"1000-1400","Семейный район с более предсказуемым доступом к школам, магазинам и спокойным ежедневным маршрутам",approved
R-0004,S-RENT-004,Минск,DST-MIN-01,DST-MIN-03,25,"850-1100","Для временного проживания важнее удобная логистика и меблированный фонд, чем максимальная оптимизация долгосрочной цены",approved
R-0005,S-CONFLICT-001,Баку,,,18,"1200-1700","Центральные районы выполняют требование по времени в пути, но не укладываются в доступный семейный бюджет для жилья с размещением с животными",clarification
R-0006,S-EDGE-001,Ташкент,DST-TAS-03,DST-TAS-04,35,"900-1350","Район подходит по аренде и времени в пути, но до подтверждения жилья нужно отдельно закрыть вопрос с документами и маршрутом релокации",escalation
